{
  "codeviz": "1.0",
  "meta": {
    "repo": "codebase-blueprint-ai",
    "branch": "v1",
    "title": "The Blueprint Press",
    "tagline": "a language model reads a repo, writes one JSON file, and a fixed renderer prints the drawing"
  },
  "stats": [
    { "label": "Node kinds", "value": "8 fixed" },
    { "label": "Edge kinds", "value": "6 fixed" },
    { "label": "LLM writes", "value": "1 file — the JSON" },
    { "label": "Output", "value": "1 HTML · 0 deps" },
    { "label": "Renderer", "value": "three.js r169, ortho" }
  ],
  "groups": [
    { "id": "authoring", "label": "The authoring pass", "order": 1, "note": "the only part a model performs" },
    { "id": "contract",  "label": "The contract",       "order": 2, "note": "what the two halves agree on" },
    { "id": "bake",      "label": "The bake",           "order": 3 },
    { "id": "drawing",   "label": "The drawing",        "order": 4, "note": "runs in the browser, every frame" },
    { "id": "surface",   "label": "What you touch",     "order": 5 }
  ],

  "nodes": [
    {
      "id": "repo_survey",
      "label": "Repo survey",
      "group": "authoring",
      "kind": "entrypoint",
      "weight": 1.2,
      "summary": "reads the manifest, the entrypoints and the directory tree before deciding anything",
      "detail": "The first phase of PROMPT.md. It reads package.json / Cargo.toml / pyproject, finds the binaries and servers, and walks the tree two levels deep. Nothing is written during this pass — its only job is to stop the model from inventing an architecture before it has seen one.",
      "paths": ["PROMPT.md"],
      "metrics": [{ "label": "Phase", "value": "1 of 6" }]
    },
    {
      "id": "node_census",
      "label": "Node census",
      "group": "authoring",
      "kind": "service",
      "weight": 1.3,
      "summary": "turns directories and modules into 15-40 subsystems, not files",
      "detail": "Collapses the tree into the units a reader would actually name out loud. Leaf modules get folded into their parent and mentioned in that parent's detail text instead of becoming their own block. The 15-40 band is enforced as a warning by the validator, because under 15 the drawing is trivial and over 40 it turns to soup.",
      "paths": ["PROMPT.md", "PROTOCOL.md"],
      "metrics": [{ "label": "Target", "value": "15-40" }]
    },
    {
      "id": "edge_tracing",
      "label": "Edge tracing",
      "group": "authoring",
      "kind": "service",
      "weight": 1.2,
      "summary": "finds real calls, channels, tables and routes — and deletes the rest",
      "detail": "Every connection has to name something concrete in its payload field: a type signature, a function, an SQL table, an HTTP route. The rule is deliberately harsh — if the model cannot name what crosses a line, the line is not real and gets dropped. This is what keeps the diagram from degenerating into boxes joined by vibes.",
      "paths": ["PROMPT.md"],
      "tech": ["grep", "ripgrep"]
    },
    {
      "id": "narrative_draft",
      "label": "Narrative draft",
      "group": "authoring",
      "kind": "service",
      "summary": "writes the right-hand panel in plain English and links phrases back to blocks",
      "detail": "Produces the WHAT IT DOES and HOW IT'S BUILT tabs as typed blocks rather than HTML, so the panel can never break the layout. Phrases wrapped in double brackets become live references: hovering one lights up the matching block in the drawing, and hovering the block lights up every phrase pointing at it.",
      "paths": ["PROMPT.md"],
      "metrics": [{ "label": "Tabs", "value": "2-4" }]
    },
    {
      "id": "authoring_model",
      "label": "Authoring model",
      "group": "authoring",
      "kind": "model",
      "weight": 1.1,
      "summary": "the language model running the six phases against a checked-out repo",
      "detail": "Any model with file-reading tools and enough context to hold a repo survey. It never touches the renderer, the stylesheet, or the build script — its entire output surface is one JSON document. That restriction is the whole reason results are reproducible instead of a new invention every run.",
      "tech": ["claude", "read", "grep"]
    },

    {
      "id": "codeviz_json",
      "label": "codeviz.json",
      "group": "contract",
      "kind": "store",
      "weight": 1.8,
      "summary": "the single hand-authored artifact: meta, stats, groups, nodes, edges, narrative",
      "detail": "Six top-level keys and nothing else. This file is the entire interface between the model and the drawing, which means it is also the thing you edit by hand when the model gets a detail wrong. Re-running the build after a manual edit takes under a second.",
      "paths": ["examples/self.codeviz.json"],
      "metrics": [{ "label": "Top-level keys", "value": "6" }]
    },
    {
      "id": "json_schema",
      "label": "JSON Schema",
      "group": "contract",
      "kind": "library",
      "summary": "draft 2020-12 definition of every field, enum and length limit",
      "detail": "Machine-readable and strict: additionalProperties is false everywhere, so a typo'd field name is an error rather than silently ignored data. Field descriptions double as authoring guidance, which is why they read like instructions instead of documentation.",
      "paths": ["schema/codeviz.schema.json"],
      "tech": ["json-schema"]
    },
    {
      "id": "validator",
      "label": "Validator",
      "group": "contract",
      "kind": "service",
      "weight": 1.4,
      "summary": "checks structure, cross-references and prose quality with zero dependencies",
      "detail": "Re-implements the schema by hand so it can also check the things JSON Schema cannot express: that every edge endpoint resolves, that every bracketed narrative reference points at a real node, that no node is left unwired. Errors block the build; warnings — vague payloads, single-sentence details, marketing language in the tagline — print and let it through.",
      "paths": ["scripts/validate.mjs"],
      "metrics": [{ "label": "Dependencies", "value": "0" }, { "label": "Rule classes", "value": "2" }]
    },
    {
      "id": "kind_table",
      "label": "Kind table",
      "group": "contract",
      "kind": "library",
      "summary": "the fixed map from node kind to footprint, height and hatching",
      "detail": "Eight node kinds and six edge kinds, closed sets. Because the mapping is a table rather than a model decision, a store always reads as a laminated slab and a queue always reads as a ribbed stack — across every repo, forever. The visual grammar stays learnable.",
      "paths": ["template/renderer.js", "PROTOCOL.md"],
      "metrics": [{ "label": "Node kinds", "value": "8" }, { "label": "Edge kinds", "value": "6" }]
    },

    {
      "id": "build_cli",
      "label": "build.mjs",
      "group": "bake",
      "kind": "entrypoint",
      "weight": 1.2,
      "summary": "one command that validates, inlines and writes the finished file",
      "detail": "Takes a codeviz.json and emits a standalone HTML document. It refuses to build on validation errors unless you pass --force, which exists for the case where you want to look at a half-finished blueprint while you fix it.",
      "paths": ["scripts/build.mjs"],
      "tech": ["node"]
    },
    {
      "id": "inliner",
      "label": "Inliner",
      "group": "bake",
      "kind": "service",
      "summary": "splices stylesheet, renderer, three.js and data into one document",
      "detail": "three.js is embedded as a base64 data URL inside an import map, which Chrome and Firefox resolve happily even from file://. That one trick is what removes the need for a dev server, a bundler, or a network connection when someone opens the result.",
      "paths": ["scripts/build.mjs", "template/index.html"],
      "metrics": [{ "label": "External refs", "value": "0" }]
    },
    {
      "id": "three_vendor",
      "label": "Vendored three.js",
      "group": "bake",
      "kind": "external",
      "summary": "r169 module build, checked into the repo rather than fetched",
      "detail": "Pinned on purpose. A CDN reference would mean a blueprint you generated last year silently changes behaviour when the CDN moves, and would break entirely on a machine without internet. The cost is about 660 KB in every output file.",
      "paths": ["vendor/three.module.min.js"],
      "tech": ["three@0.169"],
      "metrics": [{ "label": "Size", "value": "~660 KB" }]
    },
    {
      "id": "blueprint_html",
      "label": "Blueprint HTML",
      "group": "bake",
      "kind": "store",
      "weight": 1.5,
      "summary": "the deliverable: one file, no server, no network, no install",
      "detail": "Roughly a megabyte, most of it three.js. You can email it, drop it in a wiki, or commit it next to the repo it describes. Opening it from disk works because nothing inside it points anywhere outside itself.",
      "metrics": [{ "label": "Files", "value": "1" }, { "label": "Runtime deps", "value": "0" }]
    },

    {
      "id": "data_intake",
      "label": "Data intake",
      "group": "drawing",
      "kind": "entrypoint",
      "summary": "parses the embedded JSON and quarantines broken references",
      "detail": "Reads the inline JSON block, checks the protocol version, then filters out nodes with unknown groups or kinds and edges with unresolvable endpoints. Dropped items are collected and logged rather than thrown, so a nearly-correct blueprint still draws and the damage is visible in the console.",
      "paths": ["template/renderer.js"]
    },
    {
      "id": "layout_engine",
      "label": "Layout engine",
      "group": "drawing",
      "kind": "service",
      "weight": 1.4,
      "summary": "groups become bands, longest-path rank becomes columns, then it recentres",